quote,author,source
“I man is a prisoner of only his own mind.”,Michael Hawkins,
“If i had it all to do again there would be more bodies.”,Phil Baker,
"“We awaken by asking the right questions. We awaken when we see knowledge being spread that goes against our own personal experiences. We awaken when we see popular opinion being wrong but accepted as being right, and what is right being pushed as being wrong. We awaken by seeking answers in corners that are not popular. And we awaken by turning on the light inside when everything outside feels dark.”",Suzy Kassem,Rise Up and Salute the Sun: The Writings of Suzy Kassem
"“True beauty is measured by the number of pearls within you, not those around your neck.”",Suzy Kassem,Rise Up and Salute the Sun: The Writings of Suzy Kassem
“You don't need to look at the beauty to feel the love.”,Anthony T.Hincks,
“To lovers there.,De philosopher DJ Kyos,
“The thing about lips is that you always want to kiss them.”,Anthony T. Hincks,
"“You could've had anyone in the world, but you chose me.",Anthony T. Hincks,
"“Hold fast to the mountain, take root in a broken-up bluff, grow stronger after tribulations, and withstand the buffering wind from all directions.”",Zheng Xie,
"“When God was handing out stupidity, man made sure that he was at the head of the line because he wanted to be the best at everything.”",Anthony T. Hincks,
“My depth has no depth”,Mohadesa Najumi,
"“Let's say I have a mystical soul and a rational brain, and, like Montaigne, I am incapable of choosing between them. I don't know if I believe in God, but I am often tempted to believe.”",Francois Mitterrand,Memoir in Two Voices
"“The chief danger to our philosophy, apart from laziness and woolliness, is scholasticism, the essence of which is treating what is vague as if it were precise and trying to fit it into an exact logical category.”",Frank P Ramsey,
"“People say everybody has a book inside them, so why not make your life a great story?”",martha louise hunter,
“Time throws you out of its dimensionless planar like a boomerang. It unites with you again in death.”,Vishwanath S J,
"“When the mind is free, magic happens.”",C.G. Rousing,
"“Comprehending and knowing better and deeper are the best guarantees we can have to attain ideas and criteria of our own; i.e. to stop depending on what other people say. In summary, to be freer to choose our own path in life.”",Manuel Toharia-Cortés,"Galloping with Light - Einstein, Relativity, and Folklore"
"“Pretend you are foolish to the foolish, and be yourself when you are alone or with others like you, because if you take the foolish seriously as your friend, you might be a fool yourself.”",A Gentlemen,
“A loud smile is often a fake laugh.”,Saahil Prem,
“لو قال كل إنسان ما يفكر فيه بصدق فإن الحوار بين البشر يصبح قصيراً جداً.”,كونفوشيوس,
“The best way to have a good idea is to have a lot of ideas.”,Dr. Linus Pauling,
"“There are two ways of constructing a piece of software: One is to make it so simple that there are obviously no errors, and the other is to make it so complicated that there are no obvious errors.”",Tony Hoare,
"“If chance be the Father of all flesh,",Steve Turner,Poems
“What is left when honor is lost?”,Publilius Syrus,
“What i took away from witnessing the broken climbers in Moshi was this: *Everything is easy until it isn't.*”,Josh Gates,Destination Truth: Memoirs of a Monster Hunter
"“But here steps in Satan, the eternal rebel, the first freethinker and the emancipator of worlds. He makes man ashamed of his bestial ignorance and obedience; he emancipates him, stamps upon his brow the seal of liberty and humanity, in urging him to disobey and eat of the fruit of knowledge.”",Bakunin Mikhail Aleksandrovich,
"“I bargained with Life for a penny,",Jessie B. Rittenhouse,
“The bird of paradise alights only upon the hand that does not grasp.”,John Berry,
"“The scepticism which men affect towards their higher inspirations is often not an honest doubt, but a guilty negligence, and is a sign of narrow mind and defective wisdom.”",James Martineau,Tides of the Spirit: Selections from the Writings of James Martineau
"“What information consumes is rather obvious: it consumes the attention of its recipients. Hence a wealth of information creates a poverty of attention, and a need to allocate that attention efficiently among the overabundance of information sources that might consume it.”",Herbert Simon,
"“Vanity of vanities, says the Preacher,",Anonymous,Holy Bible: King James Version
“The slope contains many wonders not found at the summit.”,Marty Rubin,
"“In mathematics or physics, infinity is greater than one or two or any number countable. In how many ways can the world be destroyed based on ordered knowledge? You may be able to count this. But the truth is, you “really” don’t know. These possibilities in your mind hold a set of unpredictable orders. One effect may be causative of another of another. It could be a culmination of effects you know as events where events are sets and subsets of potential possibilities.",Dew Platt,The Rudeness of Soul
“The sun symbolizes the Divine intelligence; the empty vastness of space symbolizes the Divine All-Possibility and also the Divine immutability; a bird symbolizes the soul; a tree symbolizes the grades of being; and water symbolizes knowledge and rain revelation.”,Osman Bakar,Tawhid and Science
"“Life is an essay you yourself have to write, start to finish.”",Mo,
"“God is not a celestial prison warden jangling the keys on a bunch of lifers--he's a shepherd seeking for sheep, a woman searching for coins, a father waiting for his son.”",Clarence Jordan,The Substance of Faith: And Other Cotton Patch Sermons
“Fear is the polio of the soul which prevents our walking by faith.”,Clarence Jordan,The Substance of Faith: And Other Cotton Patch Sermons
"“Standing in the middle between the idea of an event and the actual event, a strange kind of physical reality just in the middle between possibility and reality.”",Heisenberg,
"“If we look through the aperture which we have opened up onto the absolute, what we see there is a rather menacing power--something insensible, and capable of destroying both things and worlds, of bringing forth monstrous absurdities, yet also of never doing anything, of realizing every dream, but also every nightmare, of engendering random and frenetic transformations, or conversely, of producing a universe that remains motionless down to its ultimate recesses, like a cloud bearing the fiercest storms, then the eeriest bright spells, if only for an interval of disquieting calm. We see an omnipotence equal to that of the Cartesian God, and capable of anything, even the inconceivable; but an omnipotence that has become autonomous, without norms, blind, devoid of the other divine perfections, a power with neither goodness nor wisdom, ill-disposed to reassure thought about the veracity of its distinct ideas. We see something akin to Time, but a Time that is inconceivable for physics, since it is capable of destroying without cause or reason, every physical law, just as it is inconceivable for metaphysics, since it is capable of destroying every determinate entity, even a god, even God. This is not a Heraclitean time, since it is not the eternal law of becoming, but rather the eternal and lawless possible becoming of every law. It is a Time capable of destroying even becoming itself by bringing forth, perhaps forever, fixity, stasis, and death.”",Quentin Meillassoux,After Finitude: An Essay on the Necessity of Contingency
"“Whether divine or human, it is precisely the imagination that fashions and recognizes the universe as meaningful, abiding, and valuable, that is to say, as real.”",William K. Mahony,The Artful Universe
"“The argument that coming into existence is always a harm can be summarized as follows: Both good and bad things happen only to those who exist. However, there is a crucial asymmetry between the good and the bad things. The absence of bad things, such as pain, is good even if there is nobody to enjoy that good, whereas the absence of good things, such as pleasure, is bad only if there is somebody who is deprived of these good things. The implication of this is that the avoidance of the bad by never existing is a real advantage over existence, whereas the loss of certain goods by not existing is not a real disadvantage over never existing.”",David Benatar,Better Never to Have Been: The Harm of Coming into Existence
“I wanted that future officer to weigh decisions with a supple mind and to be comfortable with nuance and uncertainty. ”,Craig M. Mullaney,The Unforgiving Minute: A Soldier's Education
“Those who wish to market their good deeds must do well to place their bad deeds on the shelve too.”,Zain Abdul Nassir,
"“All these years of thinking, ending up like this: In front of all this beauty, understanding nothing.”",Bruce Cockburn,
"“The Chicago historian Studs Terkel asked Bob Dylan in the sixties about how he went about writing a song and trying to outdo himself, or at least being as good as the last song he wrote, and his response was pretty damn perfect. “I’m content with the same old piece of wood,” he said. “I just want to find another place to pound a nail . . . Music, my writing, is something special, not sacred.” If the songs Bob Dylan wrote aren’t sacred, then nobody’s songs are sacred. Nobody’s. No one has ever laid on their deathbed thinking, “Thank god I didn’t make that song. Thank god I didn’t make that piece of art. Thank god I avoided the embarrassment of putting a bad poem into the world.” Nobody reaches the end of their life and regrets even a single moment of creating something, no matter how shitty or unappreciated that something might have been. I’m writing this just weeks after returning from Belleville, where I sat next to my dad’s bed in my childhood house and watched him die. I can guarantee you that in the final moments of his life, he wasn’t kicking himself for all those times when he dared to make a fool of himself by singing too loud.”",Jeff Tweedy,"Let's Go (So We Can Get Back): A Memoir of Recording and Discording with Wilco, Etc."
"“All I'm trying to say is that if you're not willing to observe this, if you're just going to condemn it, you're never going to see it. It's there, whether you like it or not. This is stupid life-force we're dealing with here,"" he said. ""Think how old it is, Jim. Think how huge it is. Understanding it doesn't make any difference.”",Jim Paul,Catapult: Harry and I Build a Siege Weapon
"“We are so ashamed of who we are, yet we are not too ashamed to be someone else.”",Anthony T. Hincks,
"“One has to seek out pleasurable sensations, in the absence of which blandness comes naturally. The upshot of this is that we must continually work at keeping suffering (including tedium) at bay, and we can do so only imperfectly. Dissatisfaction does and must pervade life. There are moments, perhaps even periods, of satisfaction, but they occur against a background of dissatisﬁed striving.”",David Benatar,Better Never to Have Been: The Harm of Coming into Existence
"“Actually it is quite devastating to realise how few people ever think at all. They mostly take their ideas from what they are told on the wireless, television, or in the newspapers, from people who are prepared to take a reasonable fee. To suggest anything different makes you tread on many corns of vested interest. No professional pathfinder likes you for doing it.”",Thomas Charles Lethbridge,The Power of the Pendulum
“Even if there is a small lie in the truth you telling. It will make the truth questionable.”,De_philosopher_DJKyos,
“UNDIVIDED,Suzy Kassem,Rise Up and Salute the Sun: The Writings of Suzy Kassem
“Whenever a soul leaves the body a void is felt across the world..”,Anonymous,
"“Nothing' isn't better or worse than anything. Nothing is just... nothing."" Arya Stark”",George R. R. Martin,
“When something is dirty you wash it. That's what my mum always said.,Anthony T.Hincks,
“You are the softness of the morning dew!”,Avijeet Das,
"“The most insulting aspect of insincere people is that while they're pretending to be something other than what they are, they're inherently positing a different reality to you.”",Daniel V Chappell,
"“When the school of thought is divided, the sharks shall swim in, and take their share.”",Anthony T. Hincks,
"“For over a century and a half, anarchists have been arguing that coercive, hierarchical organization (as embodied in government and corporations) is not equivalent to organization per se (which they regard as necessary), and that coercive organization should be replaced by decentralized, nonhierarchical organization based on voluntary cooperation and mutual aid. This is hardly a rejection of organization.”",Chaz Bufe,Anarchism: What It Is & What It Isn't
"“Silence is nice to have if you wanted it, but maddening if you didn't.”",Daniel V Chappell,
“Your comfort zone is a place where you keep yourself in a self-illusion and nothing can grow there but your potentiality can grow only when you can think and grow out of that zone.”,Rashedur Ryan Rahman,
“What's the use of complaining about something you have no intentions of changing it?”,Mario L Castellanos,
"“Some way some how i'm going to be happy i'm going to laugh i'm going to prosper,i feel good that i remain positive thru these mess up times!!!”",jojo1980,
"“Allaah subhanahuu, rejects those who refused Allaah’s Shareeah; the laws that are good for the Muslims; the laws that forbid what is evil. Allaah rejects those who follow laws of personal desires and who adopt laws of Kufr such as the laws enforced by the Tartars who were under the control of Gengiz Khan, their king. These laws were﻿ a mixture of Judaism, Christianity and laws chosen by their king that suited his desires. Should we prefer these laws to the Sharee`ah of Allaah and His Prophet (sallallahu alaihi wa sallam)?”",Ibnu Katsir,Tafsir Ibnu Katsir
"“Be a life long or short, its completeness depends on what it was lived for.”",David Starr Jordan,
"“…questioning the existence of God may begin because of one’s sense of disappointment rather than because of a line of reasoning. Disappointment can bring disillusionment, and disillusionment can get quite a grip on us. It may be the case that, next to the grip of disillusionment, whatever reasons we can think of to believe that God exists or that God is good will appear weak. So sometimes the reason we do not believe or the reason we stop believing is not the intellectual challenge to believing in God. Sometimes, the grip of disillusionment cannot be matched by things that seem to be only abstract or theoretical.”",Gregory E. Ganssle,Thinking about God: First Steps in Philosophy
“Animals are irrational men”,Safir Kassim Booudjelal,
"“So many other planets & stars -- could all those stars set over barren planets, beauty wasted? Or, are sunsets witnessed throughout the universe?”",Self,
"“I think, therefore a single fertilized egg cell can replicate itself into trillions of specialized and exquisitely organized cells.”",Self,
“И на съвършените съвършенството е несъвършено. Св. Иоан Лествичник”,Преподобный Никодим Святогорец,Невидимая брань
"“Part of being of a true existentialist is wanting to be what we make ourselves be by the way we choose to act, as opposed to making excuses for the way we act and regretting it.”",Gary Cox,"How to Be an Existentialist: or How to Get Real, Get a Grip and Stop Making Excuses"
"“If you write in the Old World, and against it, your work must die, go missing, be veiled, before it can live the life for which it was destined in the New World.”",Patrick Nowell-Smith,
“Mereka yang berani adalah mereka yang telah berkorban menemukan dirinya sendiri”,Ikbal Maulana,
"“There is no such thing as objectivity. We are all just interpreting signals from the universe and trying to make sense of them. Dim, shaky, weak, static-y little signals that only hint at the complexity of a universe we cannot begin to understand.”",Bones The Doctor in the Photo,
“Let education kindle only those which are truly beneficial,Baron d'Holbach,
“Logika adalah keadilan dan dialektika adalah kebijaksanaan”,Cephy Hakim,
"“Sufficiently simple natural structures are predictable but uncontrollable, whereas sufficiently complex symbolic descriptions are controllable but unpredictable.”",Howard Pattee,
"“The Great Way is not named; Great Discriminations are not spoken; Great Benevolence is not benevolent; Great Modesty is not humble; Great Daring does not attack. If the Way is made clear, it is not the Way.”",Chuang Chou,
“Great understanding is broad and unhurried; little understanding is cramped and busy. Great words are clear and limpid; little words are shrill and quarrelsome.”,Chuang Chou,
"“‎In modern physics, there is no such thing as ""nothing."" Even in a perfect vacuum, pairs of virtual particles are constantly being created and destroyed. The existence of these particles is no mathematical fiction. Though they cannot be directly observed, the effects they create are quite real. The assumption that they exist leads to predictions that have been confirmed by experiment to a high degree of accuracy.”",Richard Morris,
“The evolution revolution is here. Global sense makes common sense.”,Judah Freed,GLOBAL SENSE
"“Truth, says instrumentalism, is what works out, that which does what you expect it to do. The judgment is true when you can ""bank"" on it and not be disappointed. If, when you predict, or when you follow the lead of your idea or plan, it brings you to the ends sought for in the beginning, your judgment is true. It does not consist in agreement of ideas, or the agreement of ideas with an outside reality; neither is it an eternal something which always is, but it is a name given to ways of thinking which get the thinker where he started. As a railroad ticket is a ""true"" one when it lands the passenger at the station he sought, so is an idea ""true,"" not when it agrees with something outside, but when it gets the thinker successfully to the end of his intellectual journey.",Holly Estil Cunningham,An Introduction to Philosophy
"“Among peoples who possess a highly developed pugnacious instinct we find the greatest progress in the arts, sciences, social and political organization, commerce and industry. The instinct takes the milder form of rivalry which is the motive force of the great portion of the serious labors of mankind.”",Holly Estil Cunningham,An Introduction to Philosophy
"“It is a well known fact that even among highly cultured peoples the belief in animism prevails generally. Even the scholar may kick the chair against which he accidentally stumbles, and derive great satisfaction from thus 'getting even' with the perverse chair.”",Holly Estil Cunningham,An Introduction to Philosophy
"“…it can hardly be over-exaggerated that speculative thinking is always drawn from the necessities of the time, that it is always practical, that it always shifts with the interests of the times, with the changes of social, economic, and political conditions, and finally, that it is vain to hope to find an",Holly Estil Cunningham,An Introduction to Philosophy
“A doctrine of,Holly Estil Cunningham,An Introduction to Philosophy
“Empiricism teaches that there is a real world of fixed things on the outside and that ideas of these outside things are stamped on the mind which is at the beginning of life a blank.”,Holly Estil Cunningham,An Introduction to Philosophy
"“…let us point out precisely the difficulties of empiricism as a theory of knowledge. First, it begins with two",Holly Estil Cunningham,
“Philosophers console themselves with explanations.”,Marty Rubin,
"“No art takes places without inspiration. Every artist also needs effective knowledge of his or her tools (e.g., does a certain brush function well with a particular kind of paint?). What’s more, artists need effective techniques for using those tools.",H. E. Davey Japanese Yoga: The Way of Dynamic Meditation,
"“I can blend words easily with my pen, and show concepts from deep within. Yet not everyone gets the message I send. So why do I even let these words begin? Maybe they will soak in one day at the right time. When the readers on a new path to find. So for now I'll continue to drop ink and not worry about what other people think.”",Stanley Victor Paskavich,
"“Humankind has accumulated generation upon generation of knowledge, the culmination of which is the vast and useful technological array we see everywhere in modern society. Despite this great accumulation of knowledge and technology, we still suffer from starvation and war. The difference between the past and the present is the difference between throwing rocks and shooting missiles. We are still in conflict. Suffering on a fundamental level hasn’t ceased. But we nevertheless persist in the notion that if we just amass a bit more knowledge, we’ll all be o.k. Maybe a new philosophy will do the trick, or a new system of government. But all of this has been tried many times.",H.E. Davey,Japanese Yoga: The Way of Dynamic Meditation
“This only is denied to God: the power to undo the past.”,Agathon,
“It's a sad day for American Capitalism when a man can't fly a midget on a kite over central park.”,Jim Moran,
"“What never fails inside the mind of an intellectual never works outside the confines of his head. The world’s stubborn refusal to vindicate the intellectual’s theories serves as proof of humanity’s irrationality, not his own. Thus, the true believer retrenches rather than rethinks; he launches a war on the world, denying reality because it fails to conform to his theories. If intellectuals are not prepared to reconcile theory and practice, then why do they bother to venture outside the ivory tower or the coffeehouse? Why not stay in the world of abstractions and fantasy?”",Daniel J. Flynn,Intellectual Morons: How Ideology Makes Smart People Fall for Stupid Ideas
"“Particularity leads to peculiarity and then to pathological behavior. The three Ps. It is very insidious. You would eventually end up in a box. If you try to control your environment, it will control you. And everyone else around you will always have to be making adjustments to your maddening idiosyncracies...You are beginning to enslave yourself with your fussiness.”",Susan Trott,
"“I tried to make my life colorful with basic colors Red, Green and Blue....... ohh god... my perfection in blending made it white !!! now again confused…. should go with :( or :)”",Saket Assertive,
"“The ruinous abdication by philosophy of its rightful domain is the consequence of the oblivion of philosophers to a great insight first beheld clearly by Socrates and re-affirmed by Kant as by no other philosopher. Science, concerned solely and exclusively with objective existents, cannot give answers to questions about meanings and values. Only ideas engendered by the mind and to be found nowhere but in the mind (Socrates), only the pure transcendental forms supplied by reason (Kant), can secure the ideals and values and put us in touch with the realities that constitute our moral and spiritual life. Twenty-four centuries after Socrates, two centuries after Kant, we badly need to re-learn the lesson.”",D. R. Khashaba,
"“Call it ""a wonder"" or ""a mystery"" and you have an excuse to never try understanding it - an excuse to not take responsibility for it. People knew about love no more than they knew about Science, but at least most did not jump into Science headstrong, with the hope that they would figure it out as they went, or that some ""mysterious"" inborn trait would take care of it.”",Lynna Merrill,The Seekers of Fire
"“Identifying the flaw in the US philosophical roots requires that we move beyond the intellectual and emotional climate in which the Constitution was conceived and adopted. The meanings of concepts and words change with use, and even the Supreme Court has admitted that the original perspective of the American social contract has been altered by the passage of time.”",David E. Wilkins,The Legal Universe: Observations of the Foundations of American Law
"“Seduced by the spectacular theoretical and practical successes of the objective sciences into thinking that the methods and criteria of those sciences were the only means to truth, philosophers sought to apply those same methods and criteria to questions relating to the meaning of life and the values that give meaning to life. Philosophy, especially the Analytical species prevalent in the English-speaking world, was broken up into specialized disciplines and fragmented into particular problems, all swayed and impregnated by scientism, reductionism, and relativism. All questions of meaning and value were consigned to the rubbish heap of 'metaphysical nonsense'.”",D. R. Khashaba,
“Faith in Qur'anic revelation unveils all the possibilities that lie before the human intellect.”,Osman Bakar,Tawhid and Science
“The unity of scientific and spiritual knowledge is realized when each of the particular sciences is organically related to the supreme knowledge of al-tawhid.”,Osman Bakar,Tawhid and Science
